{
    "schema":  "pzmapforge.parsed-cell.v0.1",
    "tool":  "ImageMapForge",
    "claim_boundary":  "planning_artifact_only_not_pz_load_tested",
    "source_image":  "fixture",
    "source_image_sha256":  "0000000000000000000000000000000000000000000000000000000000000000",
    "palette":  "fixture",
    "palette_sha256":  "0000000000000000000000000000000000000000000000000000000000000000",
    "width":  300,
    "height":  300,
    "resized":  false,
    "matching":  {
                     "exact_pixels":  90000,
                     "nearest_pixels":  0,
                     "unique_source_colours":  9,
                     "unmapped_exact_colours":  0
                 },
    "legend":  [
                   {
                       "code":  "g",
                       "gid":  1,
                       "description":  "Grass or open ground",
                       "rgb":  [
                                   100,
                                   140,
                                   70
                               ],
                       "kind":  "grass"
                   },
                   {
                       "code":  "r",
                       "gid":  2,
                       "description":  "Road or asphalt",
                       "rgb":  [
                                   70,
                                   70,
                                   70
                               ],
                       "kind":  "road"
                   },
                   {
                       "code":  "s",
                       "gid":  3,
                       "description":  "Sidewalk",
                       "rgb":  [
                                   190,
                                   180,
                                   160
                               ],
                       "kind":  "sidewalk"
                   },
                   {
                       "code":  "h",
                       "gid":  4,
                       "description":  "Row house",
                       "rgb":  [
                                   160,
                                   110,
                                   80
                               ],
                       "kind":  "row_house"
                   },
                   {
                       "code":  "d",
                       "gid":  5,
                       "description":  "Depanneur",
                       "rgb":  [
                                   200,
                                   130,
                                   60
                               ],
                       "kind":  "depanneur"
                   },
                   {
                       "code":  "a",
                       "gid":  6,
                       "description":  "Garage",
                       "rgb":  [
                                   80,
                                   80,
                                   100
                               ],
                       "kind":  "garage"
                   },
                   {
                       "code":  "i",
                       "gid":  7,
                       "description":  "Industrial yard",
                       "rgb":  [
                                   160,
                                   130,
                                   90
                               ],
                       "kind":  "industrial_yard"
                   },
                   {
                       "code":  "l",
                       "gid":  8,
                       "description":  "Landmark",
                       "rgb":  [
                                   255,
                                   220,
                                   0
                               ],
                       "kind":  "landmark"
                   },
                   {
                       "code":  "p",
                       "gid":  9,
                       "description":  "Spawn",
                       "rgb":  [
                                   0,
                                   220,
                                   80
                               ],
                       "kind":  "spawn"
                   }
               ],
    "counts":  [
                   {
                       "pixels":  89992,
                       "code":  "g",
                       "gid":  1,
                       "kind":  "grass"
                   },
                   {
                       "pixels":  1,
                       "code":  "r",
                       "gid":  2,
                       "kind":  "road"
                   },
                   {
                       "pixels":  1,
                       "code":  "s",
                       "gid":  3,
                       "kind":  "sidewalk"
                   },
                   {
                       "pixels":  1,
                       "code":  "h",
                       "gid":  4,
                       "kind":  "row_house"
                   },
                   {
                       "pixels":  1,
                       "code":  "d",
                       "gid":  5,
                       "kind":  "depanneur"
                   },
                   {
                       "pixels":  1,
                       "code":  "a",
                       "gid":  6,
                       "kind":  "garage"
                   },
                   {
                       "pixels":  1,
                       "code":  "i",
                       "gid":  7,
                       "kind":  "industrial_yard"
                   },
                   {
                       "pixels":  1,
                       "code":  "l",
                       "gid":  8,
                       "kind":  "landmark"
                   },
                   {
                       "pixels":  1,
                       "code":  "p",
                       "gid":  9,
                       "kind":  "spawn"
                   }
               ],
    "nearest_drift":  [

                      ],
    "rows":  [
                 "ggggggggggggggggggggggggggggggggggggggggggggggggggggggggggggggggggggggggggggggggggggggggggggggggggggggggggggggggggggggggggggggggggggggggggggggggggggggggggggggggggggggggggggggggggggggggggggggggggggggggggggggggggggggggggggggggggggggggggggggggggggggggggggggggggggggggggggggggggggggggggggggggggggrshdailp",
                 "gggggggggggggggggggggggggggggggggggggggggggggggggggggggggggggggggggggggggggggggggggggggggggggggggggggggggggggggggggggggggggggggggggggggggggggggggggggggggggggggggggggggggggggggggggggggggggggggggggggggggggggggggggggggggggggggggggggggggggggggggggggggggggggggggggggggggggggggggggggggggggggggggggggggggggg",
                 "gggggggggggggggggggggggggggggggggggggggggggggggggggggggggggggggggggggggggggggggggggggggggggggggggggggggggggggggggggggggggggggggggggggggggggggggggggggggggggggggggggggggggggggggggggggggggggggggggggggggggggggggggggggggggggggggggggggggggggggggggggggggggggggggggggggggggggggggggggggggggggggggggggggggggggg",
                 "gggggggggggggggggggggggggggggggggggggggggggggggggggggggggggggggggggggggggggggggggggggggggggggggggggggggggggggggggggggggggggggggggggggggggggggggggggggggggggggggggggggggggggggggggggggggggggggggggggggggggggggggggggggggggggggggggggggggggggggggggggggggggggggggggggggggggggggggggggggggggggggggggggggggggggg",
                 "gggggggggggggggggggggggggggggggggggggggggggggggggggggggggggggggggggggggggggggggggggggggggggggggggggggggggggggggggggggggggggggggggggggggggggggggggggggggggggggggggggggggggggggggggggggggggggggggggggggggggggggggggggggggggggggggggggggggggggggggggggggggggggggggggggggggggggggggggggggggggggggggggggggggggggg",
                 "gggggggggggggggggggggggggggggggggggggggggggggggggggggggggggggggggggggggggggggggggggggggggggggggggggggggggggggggggggggggggggggggggggggggggggggggggggggggggggggggggggggggggggggggggggggggggggggggggggggggggggggggggggggggggggggggggggggggggggggggggggggggggggggggggggggggggggggggggggggggggggggggggggggggggggg",
                 "gggggggggggggggggggggggggggggggggggggggggggggggggggggggggggggggggggggggggggggggggggggggggggggggggggggggggggggggggggggggggggggggggggggggggggggggggggggggggggggggggggggggggggggggggggggggggggggggggggggggggggggggggggggggggggggggggggggggggggggggggggggggggggggggggggggggggggggggggggggggggggggggggggggggggggg",
                 "gggggggggggggggggggggggggggggggggggggggggggggggggggggggggggggggggggggggggggggggggggggggggggggggggggggggggggggggggggggggggggggggggggggggggggggggggggggggggggggggggggggggggggggggggggggggggggggggggggggggggggggggggggggggggggggggggggggggggggggggggggggggggggggggggggggggggggggggggggggggggggggggggggggggggggg",
                 "gggggggggggggggggggggggggggggggggggggggggggggggggggggggggggggggggggggggggggggggggggggggggggggggggggggggggggggggggggggggggggggggggggggggggggggggggggggggggggggggggggggggggggggggggggggggggggggggggggggggggggggggggggggggggggggggggggggggggggggggggggggggggggggggggggggggggggggggggggggggggggggggggggggggggggg",
                 "gggggggggggggggggggggggggggggggggggggggggggggggggggggggggggggggggggggggggggggggggggggggggggggggggggggggggggggggggggggggggggggggggggggggggggggggggggggggggggggggggggggggggggggggggggggggggggggggggggggggggggggggggggggggggggggggggggggggggggggggggggggggggggggggggggggggggggggggggggggggggggggggggggggggggggg",
                 "gggggggggggggggggggggggggggggggggggggggggggggggggggggggggggggggggggggggggggggggggggggggggggggggggggggggggggggggggggggggggggggggggggggggggggggggggggggggggggggggggggggggggggggggggggggggggggggggggggggggggggggggggggggggggggggggggggggggggggggggggggggggggggggggggggggggggggggggggggggggggggggggggggggggggggg",
                 "gggggggggggggggggggggggggggggggggggggggggggggggggggggggggggggggggggggggggggggggggggggggggggggggggggggggggggggggggggggggggggggggggggggggggggggggggggggggggggggggggggggggggggggggggggggggggggggggggggggggggggggggggggggggggggggggggggggggggggggggggggggggggggggggggggggggggggggggggggggggggggggggggggggggggggg",